{
  "$schema": "http://json-schema.org/draft-07/schema#",
  "$id": "https://shipledger.dev/schemas/config.schema.json",
  "type": "object",
  "additionalProperties": false,
  "required": ["version", "preset", "repos"],
  "properties": {
    "version": { "const": 1 },
    "preset": { "type": "string", "pattern": "^[a-z0-9-]+(@[0-9]+)?$" },
    "repos": {
      "type": "array",
      "minItems": 1,
      "items": {
        "type": "object",
        "additionalProperties": false,
        "required": ["name", "path"],
        "properties": {
          "name": { "type": "string", "minLength": 1 },
          "path": { "type": "string", "minLength": 1 }
        }
      }
    },
    "matchers": {
      "type": "array",
      "minItems": 1,
      "items": {
        "type": "object",
        "additionalProperties": false,
        "required": ["id", "sources", "pattern", "namespace", "normalize"],
        "properties": {
          "id": { "type": "string", "minLength": 1 },
          "sources": { "type": "array", "minItems": 1, "items": { "enum": ["subject", "body"] } },
          "pattern": { "type": "string", "minLength": 1 },
          "namespace": { "enum": ["global", "repo"] },
          "normalize": { "enum": ["upper", "lower", "none"] }
        }
      }
    },
    "history": { "enum": ["first-parent", "all"] },
    "ignore": {
      "type": "object",
      "additionalProperties": false,
      "required": ["authors", "subjects"],
      "properties": {
        "authors": { "type": "array", "items": { "type": "string" } },
        "subjects": { "type": "array", "items": { "type": "string" } }
      }
    },
    "extendIgnore": {
      "type": "object",
      "additionalProperties": false,
      "minProperties": 1,
      "properties": {
        "authors": { "type": "array", "minItems": 1, "items": { "type": "string" } },
        "subjects": { "type": "array", "minItems": 1, "items": { "type": "string" } }
      }
    },
    "policy": {
      "type": "object",
      "additionalProperties": false,
      "required": ["failOn"],
      "properties": {
        "failOn": {
          "type": "array",
          "items": { "enum": ["no-reference", "unknown-reference", "item-without-commits", "range-divergence"] }
        },
        "bodyReferences": { "enum": ["strict", "context"] }
      }
    },
    "links": {
      "type": "object",
      "additionalProperties": false,
      "properties": {
        "references": {
          "type": "object",
          "additionalProperties": {
            "oneOf": [
              { "type": "string", "minLength": 1 },
              {
                "type": "object",
                "additionalProperties": false,
                "required": ["url"],
                "properties": {
                  "url": { "type": "string", "minLength": 1 },
                  "stripPrefix": { "type": "string", "minLength": 1 },
                  "stripSuffix": { "type": "string", "minLength": 1 }
                }
              }
            ]
          }
        },
        "repos": {
          "type": "object",
          "additionalProperties": {
            "type": "object",
            "additionalProperties": false,
            "properties": {
              "commit": { "type": "string", "minLength": 1 },
              "references": {
                "type": "object",
                "additionalProperties": {
                  "oneOf": [
                    { "type": "string", "minLength": 1 },
                    {
                      "type": "object",
                      "additionalProperties": false,
                      "required": ["url"],
                      "properties": {
                        "url": { "type": "string", "minLength": 1 },
                        "stripPrefix": { "type": "string", "minLength": 1 },
                        "stripSuffix": { "type": "string", "minLength": 1 }
                      }
                    }
                  ]
                }
              }
            }
          }
        }
      }
    }
  }
}
